{"appCompatibility":{"maximum":null,"minimum":"phase9-production-1","productionAppReadsArtifact":true},"chunked":{"eventCount":56,"indexJson":{"bytes":21065,"contentType":"application/json","digest":"sha256:460e8ee3ac8432af1c4d2f29b60666beb5029f2a3209d70cd323e29fbf06079a","path":"releases/de044790a521508a/chunked/event-index.json"},"jsonFiles":57,"largestChunkBytes":837740,"totalJsonBytes":4935992},"counts":{"encounters":647,"enemies":4245,"events":56,"stages":647},"dataClassification":"legacy-production-baseline","datasetVersion":"legacy-production-runtime:f1cb27a2e5cae962","full":{"json":{"bytes":4915199,"contentType":"application/json","digest":"sha256:076efb18675b1b9e8b9dd9a1013b50cf6f78d1189390e44f1d3e84952b280545","path":"releases/de044790a521508a/full/runtime.min.json"}},"generatedAt":"2026-08-30T00:00:00.000Z","knownGood":{"datasetVersion":"legacy-production-runtime:f1cb27a2e5cae962","retainedReleaseCount":2,"runtimeDigest":"sha256:076efb18675b1b9e8b9dd9a1013b50cf6f78d1189390e44f1d3e84952b280545"},"permission":{"liveSourceAccessAllowed":false,"productionActivateAllowed":true,"publicArtifactAllowed":true,"syntheticDataIncluded":false,"unapprovedDerivedDataIncluded":false},"productionActivated":true,"releaseCandidate":false,"runtimeSchemaVersion":"1.0.0","schemaVersion":"1.0.0","source":{"digest":"sha256:f1cb27a2e5cae9627be61934aaabec79e4af0b42d3e21ad0cc7945eb6d7a0b40","embeddedPresetMatches":true,"kind":"existing-production-repository-data","networkRequests":0,"path":"scraper/all_enemies.json","savedCacheCandidateIncluded":false,"syntheticFixtureIncluded":false},"sourceCounts":{"areaAttacks":0,"attacks":8899,"enemies":4245,"eventTypes":56,"series":73,"stages":647},"updatePolicy":{"browserPatRequired":false,"userInitiated":true,"zeroOperationEnabled":false},"validation":{"hardFailCount":0,"note":"Repositoryで既に本番利用中の敵JSONだけを、外部通信なしでruntime/event chunksへ決定的に変換した。","projectionErrorCount":0,"reviewRequiredCount":0,"sourceAuditErrorCount":0,"status":"passed"}}